{
  "$schema": "http://json-schema.org/draft-07/schema#",
  "$id": "https://github.com/trackit/cloudfront-redirect-rules/shared/rewrite-rule.schema.json",
  "title": "Rewrite rule item (frMatchRule)",
  "$comment": "The DynamoDB item shape the Lambda@Edge reads for a rewrite (origin-request). Modeled on ForwardRewriteRule/ForwardSettings from the source project's redirect-rule-types.ts. forwardSettings.origin is assigned straight to request.origin, so it mirrors the CloudFront origin structure from @types/aws-lambda.",
  "type": "object",
  "required": ["pk", "sk", "type", "matches", "forwardSettings"],
  "additionalProperties": false,
  "properties": {
    "pk": {
      "type": "string",
      "description": "Host, e.g. www.example.com. DynamoDB partition key.",
      "minLength": 1
    },
    "sk": {
      "type": "string",
      "description": "REWRITE#<priority>, priority zero-padded to 5 digits; lower = higher priority; unique per host per type.",
      "pattern": "^REWRITE#[0-9]{5}$"
    },
    "type": { "const": "frMatchRule" },
    "matches": {
      "type": "array",
      "items": { "$ref": "redirect-rule.schema.json#/definitions/match" }
    },
    "forwardSettings": {
      "type": "object",
      "additionalProperties": false,
      "$comment": "At least one of origin / pathAndQS is meaningful; a rewrite that changes neither does nothing.",
      "anyOf": [{ "required": ["origin"] }, { "required": ["pathAndQS"] }],
      "properties": {
        "origin": {
          "$comment": "Discriminated union: exactly one of s3 / custom, matching CloudFrontOrigin (with the extended custom protocol) in redirect-rule-types.ts / @types/aws-lambda.",
          "type": "object",
          "additionalProperties": false,
          "properties": {
            "s3": { "$ref": "#/definitions/s3Origin" },
            "custom": { "$ref": "#/definitions/customOrigin" }
          },
          "oneOf": [{ "required": ["s3"] }, { "required": ["custom"] }]
        },
        "pathAndQS": {
          "type": "string",
          "description": "Rewritten path (and optional query string) the request is forwarded with: a path starting with \"/\", or a target starting with a capture reference (\"$1/x\").",
          "pattern": "^(?:/\\S*|\\$[1-9][0-9]*\\S*)?$",
          "$comment": "The edge assigns the path to request.uri, and CloudFront refuses a uri that does not start with \"/\" with a 502 (LambdaValidationError) on every request the rule matches. Whitespace is no more valid in a uri. A target starting with `$n` is a template whose leading segment only exists once the edge substitutes it, so the edge adds the \"/\" itself when the capture lacks one. Empty stays allowed: the edge reads it as \"keep the incoming path\"."
        },
        "useIncomingQueryString": {
          "type": "boolean",
          "description": "Whether the request's own query string is forwarded. Absent means yes — only an explicit false drops it. A query string written into pathAndQS wins over either.",
          "$comment": "Absent is deliberately not an opt-out: forwarding is what this field has always done when omitted, both here and in the upstream snippet, so rules written by hand keep behaving the same. See infra/lambda/README.md#the-query-string-on-a-rewrite."
        }
      }
    },
    "disabled": {
      "type": "boolean",
      "$comment": "Optional; absent means enabled. The Lambda@Edge filters out rules where disabled=true (RulesService.loadRules), so a toggle takes effect within the edge cache TTL (~1 min). The console writes it through PATCH."
    }
  },
  "definitions": {
    "originPath": {
      "type": "string",
      "pattern": "^(?:/\\S*[^\\s/])?$",
      "$comment": "Empty, or starting with \"/\" and not ending with one: \"/v1\", not \"v1\" or \"/v1/\".\n\nCloudFront validates the origin the edge returns on every request, and any origin field outside its limits turns each request the rule matches into a 502 (LambdaValidationError). The limits in s3Origin and customOrigin are CloudFront's, from the origin fields of the Lambda@Edge request event. Header names CloudFront refuses to set are checked in console/api/src/lib/assert-origin-headers.ts instead, because that check is case-insensitive and draft-07 patterns have no flag for it."
    },
    "cloudFrontHeaders": {
      "$comment": "CloudFrontHeaders: lower-cased header name -> array of { key?, value }.",
      "type": "object",
      "additionalProperties": {
        "type": "array",
        "items": {
          "type": "object",
          "required": ["value"],
          "additionalProperties": false,
          "properties": {
            "key": { "type": "string", "pattern": "^[^\\r\\n]*$" },
            "value": { "type": "string", "pattern": "^[^\\r\\n]*$" }
          }
        }
      }
    },
    "s3Origin": {
      "type": "object",
      "additionalProperties": false,
      "required": ["authMethod", "customHeaders", "domainName", "path"],
      "properties": {
        "authMethod": { "enum": ["origin-access-identity", "none"] },
        "customHeaders": { "$ref": "#/definitions/cloudFrontHeaders" },
        "domainName": {
          "type": "string",
          "minLength": 1,
          "maxLength": 128,
          "pattern": "^[a-z0-9](?:[a-z0-9.-]*[a-z0-9])?$",
          "$comment": "The bucket's DNS name, e.g. my-bucket.s3.eu-west-1.amazonaws.com: all lowercase, at most 128 characters, no scheme or path."
        },
        "path": { "$ref": "#/definitions/originPath" },
        "region": {
          "type": "string",
          "$comment": "Required by the type when authMethod is origin-access-identity; must be absent when authMethod is none."
        }
      },
      "if": {
        "properties": { "authMethod": { "const": "origin-access-identity" } }
      },
      "then": { "required": ["region"] },
      "else": { "not": { "required": ["region"] } }
    },
    "customOrigin": {
      "type": "object",
      "additionalProperties": false,
      "required": [
        "customHeaders",
        "domainName",
        "keepaliveTimeout",
        "path",
        "port",
        "protocol",
        "readTimeout",
        "sslProtocols"
      ],
      "properties": {
        "customHeaders": { "$ref": "#/definitions/cloudFrontHeaders" },
        "domainName": {
          "type": "string",
          "minLength": 1,
          "maxLength": 253,
          "pattern": "^(?![0-9]+(?:\\.[0-9]+){3}$)[A-Za-z0-9](?:[A-Za-z0-9-]{0,61}[A-Za-z0-9])?(?:\\.[A-Za-z0-9](?:[A-Za-z0-9-]{0,61}[A-Za-z0-9])?)*$",
          "$comment": "A DNS name like api.example.com: no scheme, port, path, or colon, and not an IP address."
        },
        "keepaliveTimeout": { "type": "integer", "minimum": 1, "maximum": 120 },
        "path": {
          "type": "string",
          "maxLength": 255,
          "allOf": [{ "$ref": "#/definitions/originPath" }]
        },
        "port": {
          "type": "integer",
          "minimum": 80,
          "maximum": 65535,
          "not": {
            "anyOf": [
              { "exclusiveMinimum": 80, "exclusiveMaximum": 443 },
              { "exclusiveMinimum": 443, "exclusiveMaximum": 1024 }
            ]
          },
          "$comment": "CloudFront connects to 80, 443, or 1024-65535 only. Spelled as a range minus its gaps rather than an anyOf of the allowed values, so the generated TypeScript type stays `number`."
        },
        "protocol": {
          "$comment": "CloudFrontCustomOrigin protocol (http/https) extended per redirect-rule-types.ts.",
          "enum": ["http", "https", "http-only", "https-only", "match-viewer"]
        },
        "readTimeout": {
          "type": "integer",
          "minimum": 1,
          "maximum": 120,
          "$comment": "120 is CloudFront's default quota; an account with a raised quota would need this raised too."
        },
        "sslProtocols": {
          "type": "array",
          "minItems": 1,
          "items": { "enum": ["TLSv1.2", "TLSv1.1", "TLSv1", "SSLv3"] }
        }
      }
    }
  }
}
